https://www.linkedin.com/company/russellwestbrookenterprises,Russell Westbrook Enterprises brings together Russell’s relentless work ethic and his earnest pursuit to positively impact his communities. RWE works to inspire and uplift global communities through investments and strategic partnerships. WHY NOT ? Up...,1
https://www.linkedin.com/company/650fund,"650.fund is an early stage venture capital firm that funds and guides exceptional start-ups as they evolve into valuable, impactful, responsible companies.",1
https://www.linkedin.com/company/emerson-group,"The Emerson Group is a consumer products equity organization that connects health and beauty brands to consumers. Since 1994, our purpose is 'where people and brands feel at home'. We are a trusted and valued partner to clients, retailers, suppliers, a...",1
https://www.linkedin.com/company/thefund,THE FUND is a community of 400 founders and operators who care deeply about supporting the next generation of entrepreneurs. Active across eight funds and 150 portfolio companies. Venture Capital and Private Equity Principals startups investing founder...,1
https://www.linkedin.com/company/notley,Notley Ventures is an Austin based venture capital firm that partners with game changing founders to drive industry and world altering innovations. Notley Fund invests in sustainable and scalable solutions that create positive change in people’s lives....,1
https://www.linkedin.com/company/dumbmoney,"Dumb Money is a company founded by Dave Hanson, Chris Camillo, and Jordan Mclain. They are a group of friends who quit their jobs to invest their own money and find investment ideas in their everyday lives. They aim to prove that anyone can beat Wall S...",1
https://www.linkedin.com/company/dean-enterprises-llc,"Dean Graziosi is a New York Times best seller, entrepreneur & investor. Dean uses his platform to provide training & education in business, life & overall success.",1
https://www.linkedin.com/company/greentown-labs,"Greentown Labs is a community of climate action pioneers working to design a more sustainable world. As the largest climatetech startup incubator in North America, Greentown Labs brings together startups, corporates, investors, policymakers, and many o...",1
https://www.linkedin.com/company/pipetechnologies,"Pipe is a modern capital platform that offers embedded capital solutions and working capital for business owners, enabling quick and easy access to capital for growth without dilution or restrictive debt.",1
https://www.linkedin.com/company/endurance-companies,"Endurance is a holding company that manages diversified entrepreneurial projects. Founded in 2009, Endurance's primary work is building new ventures to solve meaningful problems. They have notable companies in their portfolio, including Funding Circle,...",1
https://www.linkedin.com/company/amorusoco,"Sophia Amoruso is an award-winning serial entrepreneur, New York Times bestselling author, investor, educator, and roommate to three poodles. She is the founder of Nasty Gal and an investor at TrustFundVC. Sophia Amoruso offers Business Class, the ulti...",1
https://www.linkedin.com/company/decentranet,"Decentranet is a full service blockchain consulting firm serving entrepreneurs with a full suite of done for you services, deep industry and strategic partnerships, access to capital, and community events.",1
https://www.linkedin.com/company/the-blackstone-group,"Blackstone is the world's largest alternative asset manager, providing value-driven solutions and strategic partnerships for investors worldwide.",1
https://www.linkedin.com/company/dotdashco,"Dotdash is a digital media company that publishes online articles and videos about various subjects across categories including health, home, food, finance, tech, beauty, lifestyle, travel, and education. It operates brands including Verywell, Investop...",1
https://www.linkedin.com/company/in-q-tel,"In-Q-Tel (IQT) is an independent, not-for-profit organization that serves as a strategic investor, accelerating the development and delivery of cutting-edge technologies to U.S. government agencies. With a focus on enhancing national security, IQT conn...",1
https://www.linkedin.com/company/m13-company,"M13 is a brand development and investment company founded by brothers Carter and Courtney Reum. They specialize in accelerating businesses at the intersection of consumer products, technology, and media. With a focus on institutionalizing the brand cre...",1
https://www.linkedin.com/company/sequoia-tpi,"Sequoia is an innovative brokerage firm specializing in strategic benefits, HR, and risk management services for hyper growth companies. As a leading venture capital firm, Sequoia Capital has backed successful companies like Apple and Google.",1
https://www.linkedin.com/company/aberdare-mgmt-co-llc,"Aberdare Ventures is a leading venture capital firm focused exclusively on transformational companies that enable more efficient, less costly, smarter healthcare. They invest in healthcare-focused ventures that have the potential to revolutionize the w...",1
https://www.linkedin.com/company/bioinnovation-llc,"BioInnovation is a life sciences investment and consulting company based in Cambridge, MA. With nearly 20 years of experience in the industry, BioInnovation focuses on early stage life sciences investing and provides consulting services. The company is...",1
https://www.linkedin.com/company/1834733,"Axiom Venture Partners provides capital and strategic assistance to rapidly growing high technology companies. Axiom’s professionals bring substantial investing experience and industry expertise to the venture capital process. With over $200M in capital under management, the firm seeks to consider investment proposals in two main industry areas. The first is High Technology which includes Communications, Software, Internet Infrastructure and Information Technology. Biotechnology constitutes the second area. Located in East Hartford, Connecticut, Axiom invests actively throughout the United States in early or late stage companies. Approximately 15 Axiom portfolio companies have successfully completed IPO’s in recent years and a number of others are positioned for IPO’s when appropriate market conditions prevail. Given this success, Axiom’s investment returns rank near the top of its industry. Axiom is actively investing its third Partnership, Axiom Venture Partners III.",1
https://www.linkedin.com/company/construcciones-met-licas-feld-s-a-de-c-v-,Brad Feld is a venture capitalist at Foundry. He invests in software and Internet companies across the US. He is also an avid reader and marathon runner.,1
https://www.linkedin.com/company/boostedcommerce,"Boosted Commerce is a CPG platform focused on accelerating the growth of beloved consumer brands. We do this by acquiring, investing in, and growing third party seller businesses across Shopify and Amazon (FBA) and through original product development ...",1
https://www.linkedin.com/company/partech,"Partech is a global investment platform for tech and digital companies, led by ex entrepreneurs and operators of the industry spread across offices in San Francisco, Paris, Berlin and Dakar. Partech invests in Internet and information technology startu...",1
https://www.linkedin.com/company/prime-movers-lab,"Prime Movers Lab is a venture capital firm that invests in breakthrough scientific startups founded by inventors who have the potential to transform industries and improve billions of lives. They focus on six key areas including energy, infrastructure,...",1
https://www.linkedin.com/company/garden-city-companies,"Garden City Equity is a people first holding company that buys and holds exceptional family owned businesses. Our mission is to build a family of the most caring service companies in the world where all workers thrive, and have dignity and opportunity....",1
https://www.linkedin.com/company/l37,L37 is a hybrid venture capital and private equity investment firm that works alongside executive and founding teams to engineer global opportunities and impact at scale.,1
https://www.linkedin.com/company/skycatcher-llc,"Skycatcher is a software and Internet investor across the 'full stack' of public, private, venture capital, and onchain digital asset classes. Our full stack investment capability powers our fundamental vision: that the future of humanity is a world of...",1
https://www.linkedin.com/company/outside-interactive-inc,"Outside Inc. is the premier destination for active lifestyle enthusiasts, housing over 20 leading brands like Backpacker, Gaia GPS, and VeloNews. With a focus on adventure, health, fitness, and travel, Outside offers a range of compelling information a...",1
https://www.linkedin.com/company/svb-leerink,"Leerink Swann & Company is a full-service investment banking firm that provides institutional sales, healthcare equity research, corporate finance, and asset management services for high-net-worth clients. Leerink Swann & Company was voted Best Firm in both Biotechnology and Pharmaceuticals/Specialty Pharmaceuticals in the December 2001 Institutional Investor poll ranking the best boutique and regional firms by sector. Through its consulting affiliate, MEDACorp, Leerink Swann & Company provides biomedical-consulting services to Life Sciences companies and to the institutional investment community. MEDACorp is comprised of more than 3,000 consultants who are practicing physicians, surgeons, and biomedical professionals representing 55 clinical care specialties and 22 basic science disciplines.",1
https://www.linkedin.com/company/joincolossus,"Colossus is the premier destination for investors, founders, and operators to learn the world’s best information on business building and investing. We are creating and curating the world's best information on business and investing, delivered through ...",1
https://www.linkedin.com/company/a-rodcorp,"A Rod Corp is an investment firm that backs promising businesses with internal and external capital, works with championship teams, and creates value for investors. Our mission is to build world class companies, brands, partnerships, and entertainment ...",1
https://www.linkedin.com/company/athletic-greens,"Athletic Greens is a company that provides a daily whole food supplement powder to unlock your body’s true potential. They have invested 10 years in research to develop the highest efficacy, most complete, and truly convenient nutritional insurance. Th...",1
https://www.linkedin.com/company/startengine,"StartEngine is a top equity crowdfunding platform enabling everyday investors to support startups and early growth companies, with over 500 companies raising $300M+ from a community of 400,000+ investors.",1
https://www.linkedin.com/company/100co,100.co We build and invest in transformational companies and the founders that create them. Our investment thesis is grounded in a common thread that all are redefining legacy industries to be positioned for the next 100 years. Our initiatives span fro...,1
https://www.linkedin.com/company/bridgewater-associates,"Bridgewater Associates is a leading asset management firm founded in 1975, offering unique insights and partnerships for global investors through innovative technology and timeless principles.",1
https://www.linkedin.com/company/high-alpha,High Alpha is a venture studio that creates and funds B2B SaaS companies. We build with founders to go faster and further together. We are a venture studio that creates and invests in B2B SaaS companies. Get our newsletter: High Alpha is a venture stud...,1
https://www.linkedin.com/company/monarch-collective-llc,"Monarch Collective is a company that specializes in investing in women's sports teams, leagues, and adjacent revenue streams. They are committed to accelerating equity in global sports through venture capital and private equity principals. In addition ...",1
https://www.linkedin.com/company/socialleverage,"Social Leverage is a partnership that invests in exceptional entrepreneurs in the technology space. Social Leverage is an early stage seed investment fund that provides capital, helps syndicate, and offers strategic guidance to emerging web businesses....",1
https://www.linkedin.com/company/sb-projects-aka-scooter-braun-projects,"SB Projects is a diversified entertainment and media company with ventures integrating music, film, television, technology and philanthropy. SB Projects combines creativity, the ability to engage global audiences, and an understanding of “what's next” ...",1
https://www.linkedin.com/company/nkmcap,"NKM Capital is a San Francisco based venture capital firm that focuses on investing in early stage technology companies. Since 2013, the firm has backed industry pioneers such as Robinhood, Carta, Cruise (acquired by GM), Ripple, Boom, Relativity Space...",1
https://www.linkedin.com/company/stripesco,Stripes is a leading growth equity firm that invests in high growth Software and Consumer businesses around the world. Stripes invests globally in software and consumer companies with amazing products and helps them scale. Break into new markets or bet...,1
https://www.linkedin.com/company/dartlabs,DART Ventures empowers founders to thrive in the US Market. They invest in early stage Swiss and European teams working on breakthrough technologies that positively impact health and climate. DART Labs is an incubator for teams that build technologies ...,1
https://www.linkedin.com/company/food-x,"Food X is an international business accelerator program focused on launching food-related ventures. Founded in 2014, Food X partners with early-stage food entrepreneurs to bring out their best potential and take them and their products and services suc...",1
https://www.linkedin.com/company/jumpstart-inc-,"JumpStart combines capital, services and connections to help entrepreneurs grow, researchers commercialize and corporations innovate. A nationally recognized investing and entrepreneurial support organization unlocking the full potential of entrepreneu...",1
https://www.linkedin.com/company/seavest-healthcare,Rethink Capital Partners is an investment manager that specializes in real estate and venture capital with impact at the core of all they do. They invest in innovations that work to improve lives and allow people to flourish.,1
https://www.linkedin.com/company/archi-ge,"Archi Group was founded in 2006. Initially, the company was involved in investment and consulting activities, and since 2008, it has been actively operating in the real estate market of Georgia. Archi Group is one of the first companies that focuses on...",1
https://www.linkedin.com/company/revolution-llc,"Revolution is a Washington, DC based investment firm founded by Steve Case in 2005. Their mission is to build disruptive, innovative companies that offer consumers more choice, convenience, and control in their lives. They invest in people and ideas th...",1
https://www.linkedin.com/company/chicago-pacific-founders,Chicago Pacific Founders (CPF) is a strategic healthcare investment fund focused exclusively on healthcare services. Growing business at the forefront of care. Partnering with experienced operators in markets ripe for value based care. Building platfor...,1
https://www.linkedin.com/company/silver-lake,"Silver Lake is a global technology investment firm, with more than $92 billion in combined assets under management and committed capital. It is the global leader in technology investing, focusing on making large-scale investments in leading technology ...",1
https://www.linkedin.com/company/springbank-collective,We are Springbank Collective. We invest in founders building the tools and platforms to support all working women and working families.,1
https://www.linkedin.com/company/goodwin-law,"Goodwin is a global law firm with over 1,800 lawyers across the United States, Europe, and Asia. They specialize in complex transactions, high stakes litigations, and advisory services in the technology, life sciences, real estate, private equity, and ...",1
https://www.linkedin.com/company/twcbc-small-business,"Road Runner (www.rr.com) is one of the nation's leading cable broadband online services, serving in excess of 320,000 customers in the communities where it is available. It is a joint venture among affiliates of Time Warner, Inc., MediaOne Group, Microsoft Corp., Compaq Corp., and Advance/Newhouse. It combines the resources and strategic talent of the five partners who are world leaders in media, broadband communications, computer software and hardware, and publishing. The Road Runner character is a trademark and copyright of Warner Bros., a division of Time Warner Entertainment Company, L.P.",1
https://www.linkedin.com/company/shieldcap,Supporting the innovators who will secure our future. We invest in company founders building frontier technologies that matter,1
https://www.linkedin.com/company/evernote,"Hadar Dor is a Product Lead at Shopify and an Angel Investor. He has a background in product management at Facebook, Lyft, Postmates, and Kiva, as well as co-founding LAHacks and TestnTrace. Hadar is interested in sharing his knowledge and experiences ...",1
https://www.linkedin.com/company/wworks,An early stage investment fund WillowWorks is an Ohio WillowWood Company focusing on early stage investments and strategic partnerships that deliver innovation to broad markets. Investment Management investment innovation strategic partnership commerci...,1
https://www.linkedin.com/company/data-collective,"DCVC is a deep tech venture capital firm that backs entrepreneurs using Deep Tech to solve trillion dollar problems. They focus on seed, Series A, and growth stage companies that apply deep compute, big data, and IT infrastructure technologies to trans...",1
https://www.linkedin.com/company/cherre,"Cherre is a market network for real estate that connects all real estate data and makes it available to the entire organization. They provide AI-powered analytics and insights to help decision makers make better investment, management, and underwriting...",1
https://www.linkedin.com/company/blue-startups-llc,"Blue Startups is a Honolulu based venture accelerator founded by Henk Rogers of Blue Planet Software (sole agent of Tetris®). Blue Startups invests and provides hands on mentorship to capital efficient and scalable technology companies, including Inter...",1
https://www.linkedin.com/company/bitkraft-holding,"We provide early- and mid-stage venture capital and expertise for extraordinary founders in gaming, esports, and interactive media.",1
https://www.linkedin.com/company/unionlabs,"Union Labs is a DeepTech Seed fund that invests in exceptional founders from diverse backgrounds who are applying deep technologies to solve hard problems in the physical world. Core focus areas include: IoT, ClimateTech, InsurTech, AI/ML, Autonomy, Ma...",1
https://www.linkedin.com/company/innovation-works,"Innovation Works is a company that aims to introduce, connect, support, and expand the startup and entrepreneurial ecosystem in Southwestern Pennsylvania. They invest capital, business expertise, and resources into high potential technology startups wi...",1
https://www.linkedin.com/company/lombardstreet.io,"Lombardstreet Ventures is a pre-seed venture capital firm that invests in distributed teams with headquarters in Silicon Valley. They provide funding, expertise, and guidance to a small group of highly selected entrepreneurs to ensure the creation of h...",1
https://www.linkedin.com/company/kiwi-inc-,"Kiwi is a leading mobile developer focused on creating high quality games for Android and iOS. Kiwi is a Top Developer on Google Play, with five games having reached the Top 25 Grossing and more to come! Kiwi is backed by respected venture capital firm...",1
https://www.linkedin.com/company/manchesterstory-group,"ManchesterStory is a venture capital firm that specializes in investing in game-changing companies in the financial services, healthcare, and insurance sectors. They provide strategic capital to fuel growth and long-term partnerships with market-leadin...",1
https://www.linkedin.com/company/m25-group-llc,"M25 is an early stage venture firm based in Chicago, investing solely in tech startups headquartered in the Midwest. Since we launched in 2015, we've become the most active investor in our region. We are led by two of the youngest fund managers in the ...",1
https://www.linkedin.com/company/bdmi,"Part of media company Bertelsmann, BDMI initially invests $100k to $4m in seed and early stage digital media startups in online video, nextgen publishing and pubtech/adtech.",1
https://www.linkedin.com/company/playground-global,"Playground Global is a venture capital firm that invests in early stage companies with emerging technologies in science and engineering, including artificial intelligence, automation, next generation computing, neuro morphic computing, quantum technolo...",1
https://www.linkedin.com/company/mgv-seed,"MGV is a top-performing SaaS venture fund that specializes in investing in and supporting enterprise software startups. With a focus on exceptional talent, MGV takes an active role in the growth of these startups, helping founders build scalable go-to-...",1
https://www.linkedin.com/company/hudson-valley-startup-fund,"The Hudson Valley Startup Fund is a member managed seed capital fund located in New York’s Hudson Valley. We provide funding and support to high growth companies with a presence in the Hudson Valley, seeking to generate returns for our member investors...",1
https://www.linkedin.com/company/vensci,"Venture Science is a quant venture research and investment firm in San Francisco. Venture Science invests in growth stage private technology companies. We use math, decision theory and AI to make investment decisions. Venture Capital firm with economic...",1
https://www.linkedin.com/company/lemnos-labs-inc,"Lemnos Labs, based in San Francisco, provides seed investment, mentorship and encouragement to talented engineers with innovative ideas and a passion for making things",1
https://www.linkedin.com/company/startupbootcamp,Startupbootcamp is a global network of industry focused startup accelerators that provides investment and mentorship services. Startupbootcamp is a global network of industry focused accelerators. We ensure startups thrive by giving them direct access ...,1
https://www.linkedin.com/company/betaboom,"Beta Boom is a pre-seed and seed VC fund that invests in impact startups building the future for overlooked populations. They focus on investing in software companies that cater to women and multicultural communities, with a particular emphasis on unde...",1
https://www.linkedin.com/company/juno-search-group-inc.,"Juno Search Group is an executive search firm specializing in the financial services industry. With over 30 years of experience, we place professionals at all levels in the areas of private equity, venture capital/growth equity, investment banking, and...",1
https://www.linkedin.com/company/lifesci-advisors,Our biotech investor relations services are designed to increase our clients’ visibility within the investment community and to educate investors about...,1
https://www.linkedin.com/company/agilitycollective,"Agility Collective is a venture studio of inspired business leaders with a shared methodology for building the next generation of direct to consumer brands. Our resources, talent, and evolving technology stack serve as a launchpad for our portfolio com...",1
https://www.linkedin.com/company/bloccelerate,"Bloccelerate VC is a venture fund and accelerator based in Seattle, WA. They back bold entrepreneurs who are building category-defining companies using the power of blockchain technology. Bloccelerate provides these entrepreneurs with world-class mento...",1
https://www.linkedin.com/company/the-virtual-handshake,"The Virtual Handshake is a company that specializes in investing, raising capital, sales training, and recruiting using social media tools. They provide guidance on how to use blogs, social network sites, and social software to become more successful i...",1
https://www.linkedin.com/company/allegiscyber,"AllegisCyber Capital is a leading early stage venture capital investor focused on cyber security and data sciences. They provide seed and early stage investments in cybersecurity and its applications in emerging technology markets, including big data a...",1
https://www.linkedin.com/company/bl3ndlabs,"BL3NDlabs is a strategy, design & technology firm that builds products, platforms, and brands for funded startups and Fortune 1000 companies. They specialize in digital product strategy, design, and technology, and work with clients who are investing i...",1
https://www.linkedin.com/company/innosance,"Innosance is a consulting firm that provides subject matter expertise, network, and investment to Application Development and FoodTech companies. Innosance provides subject matter expertise, network, and investment to companies in Food & Beverage, Hosp...",1
https://www.linkedin.com/company/openview-,"OpenView is a venture capital firm that specializes in helping expansion stage software companies become market leaders. Through their Expansion Platform, they provide operational support to their portfolio companies, helping them hire top talent, acqu...",1
https://www.linkedin.com/company/next47,"Next47 is a global venture firm built for enterprise founders. Based in Silicon Valley, and with offices in the US, Europe, and Israel, we lead investments in early and expansion stage companies, with focus on SaaS, AI/ML and Dev Tools, Enterprise IT a...",1
