https://www.linkedin.com/company/entradavc,"Entrada Ventures is a venture capital firm helping founders avoid critical mistakes, secure capital, and build transformative companies.",2
https://www.linkedin.com/company/chrysalis-ventures,"Chrysalis Ventures is a venture capital firm that has invested in over 70 technology-enabled businesses across various industries. They focus on industries such as business services, communications, construction, education and corporate training, energ...",2
https://www.linkedin.com/company/next-wave-ventures,"Next Wave Impact is a global movement driving impact, diversity, and inclusion in early stage investing and the entrepreneurial ecosystem. They focus on increasing women's participation in angel investing as an asset class through their Next Wave Angel...",2
https://www.linkedin.com/company/isg-capital-australia,"ISG Capital is a company that connects capital and capability, creating successful commercial transactions. They provide equity capital to business and property projects/transactions, joint venture with commercial operators, and acquire holdings in com...",2
https://www.linkedin.com/company/arenda-capital-management,"Arenda Capital Management is a private investment firm based in Beverly Hills, California that invests in real estate and real estate related opportunities across the United States. Arenda Capital Management is a private investment firm based in Beverl...",2
https://www.linkedin.com/company/steadview-capital,"Steadview is a leading investment manager that makes concentrated, long term investments in high growth public and private technology companies. Steadview is a leading alternative asset manager based in Hong Kong. Steadview is an India focused investme...",2
https://www.linkedin.com/company/bow-capital,"Bow Capital is an early stage (Series A and B focused) venture firm. Founded in partnership with the University of California, we're building a different kind of venture fund one that bridges academia, sports and entertainment, and business. Our firm i...",2
https://www.linkedin.com/company/healthx-ventures,HealthX Ventures is healthcare technology focused venture fund investing in pre-revenue and early stage companies.,2
https://www.linkedin.com/company/quest-venture-partners,"Quest Venture Partners is an early stage venture capital firm located in Menlo Park, CA. They invest between $100k-$1.5MM in technology and Neurable is building the next generation of non-invasive brain computer interfaces. ProGuides is the eSports lea...",2
https://www.linkedin.com/company/mark-vc,"mark vc is an early stage venture capital firm based in Austin, TX focused primarily on technology investments across a wide range of industries, including healthcare, security & defense, consumer, software as a service, and many more.",2
https://www.linkedin.com/company/sovereign's-capital,"Sovereign's Capital is a company that primarily focuses on Healthcare, IT, and Consumer Products & Services in the US and Southeast Asia since 2012. They provide capital and strategic partnership to values-driven, market-leading companies and funds wit...",2
https://www.linkedin.com/company/wright-ventures,Wright Ventures is a seed stage venture capital fund located in the Seattle area. The fund focuses on seed stage investments in the consumer mobile area. Venture Capital and Private Equity Principals,2
https://www.linkedin.com/company/one-equity-partners,"One Equity Partners is a middle market private equity firm with over $4 billion in assets under management focused on transformative combinations within the industrial, healthcare and technology sectors in North America and Europe. The firm builds mark...",2
https://www.linkedin.com/company/seekinvest,SeekInvest is a company that specializes in values investing for financial advisors. They help financial advisors align clients' financial goals with their values to deliver a positive investment impact. SeekInvest also offers personalized financial se...,2
https://www.linkedin.com/company/vc23,"VC23 Investors is a venture capital firm based in the United States. Our mission is to find, analyze, and structure venture capital investments in companies to provide significantly above-market returns. We focus on investing in early-stage breakthroug...",2
https://www.linkedin.com/company/loud-capital,"LOUD Capital is an alternative investment and venture capital firm headquartered in Columbus, OH. They provide early stage capital and support to young, promising startups and companies. LOUD Capital offers a variety of solutions to investors and entre...",2
https://www.linkedin.com/company/tsvcap,"TSVC is a leading early stage venture capital fund in Silicon Valley. They are an early stage VC fund and have invested in over 180 startups. They provide capital investment, guidance, and infrastructure to help raise great companies from the ground up...",2
https://www.linkedin.com/company/oak-investment-partners,"Oak Investment Partners is a multistage venture capital firm and a lead investor in the next generation of enduring growth companies. The primary investment focus is on high growth opportunities in Clean Energy, Financial Services Technology, Healthcar...",2
https://www.linkedin.com/company/victress-capital-llc,"Victress partners with strong, tenacious & driven female founders. We combine capital and mentorship, and leverage our networks, to support our portfolio co's.",2
https://www.linkedin.com/company/avestria-ventures,"AVESTRIA VENTURES Avestria Ventures Management LLC is a California based venture capital firm which invests in early stage women's health and life science companies, with a primary focus on investing in women led companies. Seeding women's health & fem...",2
https://www.linkedin.com/company/motley-fool-ventures,"Motley Fool Ventures is an early stage, technology focused venture capital fund, powered by The Motley Fool’s brand, investing approach and communities. Based in Alexandria, Va., Motley Fool Ventures brings The Motley Fool’s investing principles and me...",2
https://www.linkedin.com/company/feenix-venture-partners-llc,"Feenix Venture Partners is a New York-based investment firm that partners with consumer-facing businesses raising growth capital. They focus on companies in industries such as specialty retail, food & beverage, education, health & wellness, lifestyle b...",2
https://www.linkedin.com/company/missionbiocapital,"We’re a VC firm making pivotal early stage investments in biotech companies. We support companies with lab space, capital, and strategic partners; idea to exit. Mission BioCapital is a VC firm making pivotal early stage investments in biotech companies...",2
https://www.linkedin.com/company/parkway-venture-capital-llc,Parkway VC is a venture capital firm that operates at the intersection of vision and execution. They help companies accelerate from seed round to growth equity. The firm is founded by successful entrepreneurs with deep business experience and a track r...,2
https://www.linkedin.com/company/baleon-capital,"Baleon Capital is a venture capital and private equity firm that specializes in investing in B2B growth technology companies in the healthcare and tech-enabled business services sectors. As the first institutional investor, Baleon backs capital-efficie...",2
https://www.linkedin.com/company/audaciousventures,Audacious Ventures is a venture capital and private equity firm that partners with the world's most ambitious founders in technology. We help these founders achieve their most audacious goals by providing them with the necessary resources and support. ...,2
https://www.linkedin.com/company/kicker-ventures,"Kicker Ventures is a venture capital fund that invests in companies developing novel, transformational technology solutions to the world’s healthcare problems. They support ideas that use technology to listen for biosignals in our bodies, hunt for patt...",2
https://www.linkedin.com/company/jedar-capital,"Venture Capital/Syndicate focusing on emerging markets: Middle East, Africa & Pakistan (MEAP). We support early stage founders from pre-seed to series A",2
https://www.linkedin.com/company/peak-state-ventures,Peak State Ventures is a venture capital firm based in New York and San Francisco. We partner with visionary founders who are shaping the future of work. Our focus is on companies that are making enterprises data-driven and workforce agile. We believe ...,2
https://www.linkedin.com/company/nextventuresvc,"NEXT VENTŪRES is a venture capital fund investing in innovative health and wellness companies. They are a new venture capital firm designed to invest in growth-oriented companies in the sports and fitness, outdoor and endurance, and nutrition and welln...",2
https://www.linkedin.com/company/speroventures,"Spero Ventures is an early stage venture capital firm backed by eBay founder Pierre Omidyar and staffed with former founders & operators from landmark companies, including eBay and Tesla. We believe purpose led companies outperform all others, and with...",2
https://www.linkedin.com/company/silas-capital,Silas Capital is a growth equity and VC firm investing in the next generation of consumer brands. They are an investment partner for visionaries building exceptional brands at the intersection of commerce and influence. They specialize in investing in ...,2
https://www.linkedin.com/company/voyager-capital,"Voyager Capital is a leading Pacific Northwest venture firm providing entrepreneurs with the resources, experience and connections to build successful technology companies. Voyager leads first venture round investments in software, analytics and cloud ...",2
https://www.linkedin.com/company/intuition-capital,"Intuition Capital is an investment firm helping to build companies in tech, consumer goods, marketplaces, and more. New York, NY info@intuitioncap.com Early stage Investment firm based between NY and LA investing in consumer. Intuition has been in mark...",2
https://www.linkedin.com/company/predictive-venture-partners,Predictive VC is an early stage venture capital firm that invests in bold teams harnessing data science for outsized impact. They are committed to leveling the professional and societal playing field by backing category defining companies that unlock u...,2
https://www.linkedin.com/company/nsg-ventures,NSG Ventures is a global biotech venture capital firm started and managed by scientists and founders of successful biotech companies. They focus on investing in and building early stage transformative drug discovery companies worldwide. With experience...,2
https://www.linkedin.com/company/metrodora-ventures,Metrodora is an NYC based venture capital firm focused on early stage health and learning businesses.,2
https://www.linkedin.com/company/cultivation-capital,Cultivation Capital is a venture capital firm that invests in young companies whose ideas have the potential to transform the way we live and work. They provide capital resources and a large network of partners and investors to help companies succeed. ...,2
https://www.linkedin.com/company/halo-investing-inc,Halo Investing is a disruptive award-winning platform connecting advisors and investors to protective investment solutions globally.,2
https://www.linkedin.com/company/thresholdvc,Threshold Ventures is an early stage venture capital firm that partners with visionary founders at the threshold of explosive growth. They specialize in providing capital and strategic support to startups in various industries. With a focus on technolo...,2
https://www.linkedin.com/company/lightstone-ventures,Lightstone Ventures is a global venture capital fund dedicated to translating novel scientific breakthroughs into clinically and commercially meaningful therapies. We invest in biotech and medtech companies pioneering the big ideas poised to transform ...,2
https://www.linkedin.com/company/g9-ventures,"G9 Ventures is a venture capital and private equity firm that invests in early stage companies. They focus on companies that empower consumers to live, look, and feel better. G9 Ventures is dedicated to opening doors and creating partnerships.",2
https://www.linkedin.com/company/cava-capital,"Cava Capital is an early growth stage investment firm focused on companies aimed squarely at the intersection of data driven decision making, marketing solutions, media and mobile. We are business builders, actively assisting our CEO's in critical area...",2
https://www.linkedin.com/company/riso-capital,"Riso Capital is a global venture capital and private equity firm based in Silicon Valley and Europe. With roots in India and connections in Israel, Riso Capital specializes in helping early-stage startups grow by providing meaningful operational and st...",2
https://www.linkedin.com/company/spark-capital-llc,"Spark Capital is a venture capital firm that partners with exceptional entrepreneurs seeking to build disruptive, world changing companies. We invest in startups that make products and services for consumers as well as business people. We have offices ...",2
https://www.linkedin.com/company/taihill-venture,"Taihill Venture is a Boston based, industry agnostic, pre seed, seed stage deeptech fund focusing on breakthrough technologies that are solving long existing problems. We are a group of young emerging leaders from all over the world, with the vision of...",2
https://www.linkedin.com/company/soma-capital,"Soma Capital is a venture capital fund built by founders for founders. Since its launch in 2015, it has seeded 20 unicorns, including companies like Astranis, Alto, Cruise, Rippling, Ironclad, Razorpay, and Lattice. Soma Capital invests in brilliant an...",2
https://www.linkedin.com/company/trousdaleventures,"Trousdale Ventures is a venture capital firm that partners with companies that are designing the future of health, happiness, and productivity.",2
https://www.linkedin.com/company/pegasus-tech-ventures,"Pegasus Tech Ventures is a global venture capital firm based in Silicon Valley, offering intellectual and financial capital to exceptional emerging technology companies around the world.",2
https://www.linkedin.com/company/texo-ventures,"TEXO Ventures is an early stage healthcare venture capital firm in Austin, TX dedicated to investing in and building innovative healthcare companies. TEXO Ventures works side by side with entrepreneurs, providing the foundation of capital and expert gu...",2
https://www.linkedin.com/company/ensemblevc,Ensemble VC is a modern early stage venture capital firm that is backed by category defining operators and investors. They leverage their data platform and functional experts from their network of strategic advisors to help companies build the right te...,2
https://www.linkedin.com/company/fifth-wall-ventures,"Fifth Wall is the largest venture capital firm focused on the global real estate industry and property technology for the Built World. With approximately $3.2 billion in commitments and capital under management, Fifth Wall connects many of the world's ...",2
https://www.linkedin.com/company/lifeforce-capital,Lifeforce Capital is an investment firm that focuses on software companies in the healthcare industry. They invest in companies that are disrupting the traditional biotechnology sector with innovative technologies and care models. Their portfolio compa...,2
https://www.linkedin.com/company/season-two-ventures,"Season Two Ventures is an early stage venture fund based in Southern California investing in B2B companies in both the US and India. The fund seeks to generate value by identifying large scale problems, finding companies to solve those problems, and cr...",2
https://www.linkedin.com/company/twobearcapital,"Two Bear Capital is a venture capital firm that invests in early stage companies with disruptive innovations in biotech, bioinformatics, machine learning/AI, and cybersecurity. Led by Michael Goguen, TBC aims to support companies that are positioned to...",2
https://www.linkedin.com/company/kilonova-capital,"Kilonova Capital is a San Francisco-based asset manager that invests in special situation financings and buyouts of proven, private technology companies. They provide structured, disciplined capital and invest across both the life cycle and capital str...",2
https://www.linkedin.com/company/trustventures,Trust Ventures is a company that seeks out startups tackling society's biggest challenges. They invest in these startups and provide them with advisory support. Trust Ventures aims to break down public policy barriers and unleash the transformative val...,2
https://www.linkedin.com/company/true-beauty-ventures,"True Beauty Ventures is an early stage venture fund that specializes in investing in emerging brands in the beauty, personal care, and wellness sectors. They target equity investments of $1-5 million in brands with approximately $2 million in revenue. ...",2
https://www.linkedin.com/company/green-d-ventures,"AVG gives individuals unparalleled access to venture capital investing. We build smart, diversified VC portfolios seeking to outperform the market.",2
https://www.linkedin.com/company/quiet-capital,"Quiet Capital is a company that invests in remarkable founders from day zero. They provide quiet capital to move the world further, faster. They focus on investing in technology businesses early to create long-term value.",2
https://www.linkedin.com/company/blue-moon-ventures,"Blue Moon Ventures is a leading provider of advertising services. We specialize in creating innovative and effective advertising campaigns for businesses of all sizes. Our team of experts combines creativity, strategy, and technology to deliver impactf...",2
https://www.linkedin.com/company/theventurecity,"TheVentureCity is a global, early stage venture fund that invests in mission-driven and diverse founders. They provide capital, expertise, and a network of resources to help founders accelerate their tech startups. The company is structured as a city a...",2
https://www.linkedin.com/company/shrug-capital,"Shrug Capital is a venture capital firm that specializes in investing in consumer startups. They focus on providing funding and support to companies in the virtual reality, augmented reality, consumer social, and meme industries. With a unique approach...",2
https://www.linkedin.com/company/harrison-ventures-inc,"Scout Ventures (""Scout"") is the premier ""Series Seed"" technology investor in New York City. Through its 40+ investments, Scout is the first stop for companies moving from angel to institutional investors. Scout enables entrepreneurs to build great ...",2
https://www.linkedin.com/company/casa-verde-capital,Casa Verde Capital is a leading venture capital firm that focuses exclusively on the cannabis industry. They make early stage investments in innovative and fast-growing ancillary businesses in the emerging cannabis market. With a team of experienced co...,2
https://www.linkedin.com/company/unpopular-ventures,Unpopular Ventures is a venture capital firm that focuses on investing in early-stage technology companies. They aim to find the best companies before they become popular and support them in turning their visions into reality. Unpopular Ventures partne...,2
https://www.linkedin.com/company/find-invest-grow-fig-,"Fig provides a pragmatic new approach to supporting and investing in high growth early stage companies. Fig brings together exciting early stage companies and experienced, value added investors. Its current portfolio includes fitness equipment manufact...",2
https://www.linkedin.com/company/social-capital-lp,"Social Capital is a venture capital and private equity firm that makes big bets on transformational ideas, technology, and people. Their mission is to transform society by using technology to solve the world's hardest problems. They strategically inves...",2
https://www.linkedin.com/company/cross-culture-ventures,MaC Venture Capital is a seed-stage venture capital firm that invests in technology startups leveraging shifts in cultural trends and behaviors.,2
https://www.linkedin.com/company/wilder-capital-inc,"Wilder Capital is a mission-driven investment company that focuses on supporting early-stage direct-to-consumer better-for-you food and beverage brands. They invest in and advise these brands, helping them grow organically by leveraging their relations...",2
https://www.linkedin.com/company/2-a-m-ventures,"2amvc is a venture capital firm that invests in early stage startups in India. They are focused on building a portfolio of Indian companies that are changing the world. They provide funding and support to these startups, helping them grow and succeed. ...",2
https://www.linkedin.com/company/tecton-capital-partners-llc,"Tecton Capital Partners LLC is a company that designs, builds and manages specialized investment platforms on behalf of significant investors.",2
https://www.linkedin.com/company/right-side-capital-management,"Right Side Capital Management is a venture capital and private equity firm that provides systematic pre-seed and seed stage capital to tech startups. They offer funding ranging from $50K to $200K, with the majority falling between $100K to $150K. The t...",2
https://www.linkedin.com/company/uvconnect,"Upstate Venture Connect (UVC) is a non profit that provides thought leadership, intelligence, and networking opportunities for founders building world class businesses in Upstate NY. UVC helps entrepreneurs build the connections needed to scale their b...",2
https://www.linkedin.com/company/valorvc,Valor Ventures is a venture capital firm based in Atlanta that specializes in leading seed rounds for software companies in the Southeast. They use their unique Inclusion Premium investing approach to support startups in the B2B software industry. Valo...,2
https://www.linkedin.com/company/draper-investment-company,"Draper Richards L.P. is a venture capital firm investing in early-stage information technology and telecommunications companies. We fund entrepreneurs with the energy, vision, experience, and desire to build great companies.",2
https://www.linkedin.com/company/agroecology-capital,"Agroecology Fund and Agriculture Venture Capital fund. Investor in agriculture technologies that will mitigate climate change. Next-generation proteins, next-generation seeds, animal feed, vertical farming, investment",2
https://www.linkedin.com/company/moore-venture-partners,"MVP FUNDS | MOORE VENTURE PARTNERS Founded in 2010, Moore Venture Partners (MVP) is a traditional venture capital firm investing in early, growth, and expansion stage technology and life science companies Moore Venture Partners (MVP) is a traditional v...",2
https://www.linkedin.com/company/graph-ventures,"Graph Ventures is a venture capital firm that specializes in early stage investments. With over 200 investments since 2011, we have a strong track record of supporting and scaling technology companies globally. Our team, comprised of experienced founde...",2
https://www.linkedin.com/company/fearlessvc,Fearless Ventures is a venture capital firm committed to helping the world's best entrepreneurs become conscious leaders and build businesses for the benefit of all stakeholders. We invest in the world's most promising startups and provide founders and...,2
https://www.linkedin.com/company/capital-innovators,"Capital Innovators provides top ranked Accelerator programs, venture fund management, and corporate innovation. Capital Innovators is the innovation engine for startups, corporations, and universities. The Capital Innovators Accelerator Program, based ...",2
https://www.linkedin.com/company/k50-ventures,K50 Ventures is a purpose-driven venture capital firm that provides pre-seed and seed capital for purpose-driven companies. They partner with founders who are building technology to serve the 4 billion middle-class consumers around the world. K50 Ventu...,2
https://www.linkedin.com/company/social-innovation-ventures,"Social Innovation Ventures is a company that invests in transformative founders to accelerate equity. They are active angel investors and advisors, supporting leaders who are passionate about eliminating health inequity. The company invests in companie...",2
https://www.linkedin.com/company/rpm-ventures,"RPM Ventures is an early stage venture capital firm that has been investing in revolutionary businesses for two decades. RPM Ventures, founded in 2000, is a seed and early stage venture firm with $75 million under management. RPM concentrates its inves...",2
https://www.linkedin.com/company/source-capital-llc,Source Capital is a private investment firm that provides flexible equity and debt capital to lower middle market companies across a broad range of industries. Our investment strategy targets growing companies with > $2 million in EBITDA seeking a grow...,2
https://www.linkedin.com/company/encore-consumer-capital-sf,Encore Consumer Capital is an innovative private equity firm built specifically to help consumer products companies grow.,2
https://www.linkedin.com/company/merakventures,"Merak Ventures is a sector agnostic, early stage venture fund that invests in seed stage, B2B, and emerging technology companies. They focus on companies that are solving real problems and creating large scale impact. Merak Ventures is open to investin...",2
https://www.linkedin.com/company/supernode-ventures,"Supernode Ventures is a pre series A venture fund that invests in women's health companies. Founded in 2017 by Laurel Touby, the fund focuses on early stage, sector agnostic tech companies. With a network of over 50 founders, CEOs, and executive level ...",2
