https://www.linkedin.com/company/dmvcapital,"DMV Capital is a full-stack investment and consulting firm that specializes in venture capital, equities, and credit. We provide financial services to help businesses scale and grow. Our expertise includes finance strategy, operations, technology enabl...",2
https://www.linkedin.com/company/elysiumvc,"Elysium Venture Capital is a premier investment management group focused on helping high growth technology companies access the global market. With strong ties in Silicon Valley, Europe, and China, the group runs venture funds, fund of funds, and speci...",2
https://www.linkedin.com/company/activatecapital,"Activate invests in high-growth companies using transformative technologies to build a sustainable, efficient and economically vibrant future.",2
https://www.linkedin.com/company/kombo-ventures,"Kombo Ventures is a diversified holding company focused on launching, operating, and investing in consumer brands, technology, and entertainment. Kombo has co-founded three rapidly growing direct-to-consumer brands (Glamnetic, Insert Name Here, and Wak...",2
https://www.linkedin.com/company/mirador-capital-partners,"Mirador Capital Partners is a Tri Valley investment management firm with a 30 year history of advising individuals, families, institutions and businesses. Our team’s goal is to make our clients’ lives more Profitable, Simple, and Fun. We invest our own...",2
https://www.linkedin.com/company/russell-street-ventures,"Russell Street Ventures is an innovative healthcare firm focused on launching and scaling companies that serve some of our nation’s most vulnerable and underserved patient populations. Founded by Brad Smith, RSV is in Nashville, Tennessee. Changing the...",2
https://www.linkedin.com/company/enduringventures,"Enduring Ventures is a long term holding company dedicated to buying and building beautiful businesses and stewarding them with exceptional, values driven leadership. We partner with diverse, young and non traditional leaders to buy and grow businesses...",2
https://www.linkedin.com/company/tracker-capital-management,Tracker Capital Management is a stage agnostic venture capital firm that principally invests in emerging technologies. Tracker Capital aims to invest in emerging technologies and companies across various end markets and stages of growth.,2
https://www.linkedin.com/company/st-augustine-capital-partners,"St. Augustine Capital Partners is a Texas-based, investment and advisory partnership focused on energy and infrastructure opportunities. St. Augustine advises clients in a number of key areas including: Strategy & Operations, Mergers & Acquisitions, Strategic Due Diligence, and Business Development. \r\n\r\nSince 2012 our goal has been to help clients navigate complex business and industry challenges by offering long-term, sustainable solutions. At St. Augustine, we are able to provide clients with the type of thoughtful approach needed to obtain their business and growth objectives. \r\n\r\nSt. Augustine’s client base ranges from start-ups to established corporations in a variety of industries including technology, energy, real-estate, engineering, and financial services.",2
https://www.linkedin.com/company/avalancha-ventures-sapi-de-cv,Avalancha Ventures is a Mexican venture capital investor focused on innovative technology companies in their first years of operation. They specialize in early-stage investments in unique teams that develop massively scalable solutions through innovati...,2
https://www.linkedin.com/company/adaptvc,Adapt Ventures is an early stage venture firm that invests globally in electric founders with an uncontrollable passion to create.,2
https://www.linkedin.com/company/magical-capital,"Magical Capital is an investment house empowering and representing groundbreaking investors and corporates looking to invest, acquire, or work with high-tech companies all over the world. They offer financial services, investments, acquisitions, and di...",2
https://www.linkedin.com/company/wild-ventures-vc,"Wild Ventures is an early stage venture fund focused on consumer health products and technology. We believe that the best way to combat chronic health conditions is lifestyle, not pills and surgery, so we invest in companies that empower people to lead...",2
https://www.linkedin.com/company/mdcventures,"MDC Ventures is the early stage venture capital arm of MDC Partners, a global advertising group. They invest in tech startups that are disrupting the advertising, media, and marketing industry. Their focus is on marketing technology companies that are ...",2
https://www.linkedin.com/company/lool-ventures,"lool ventures is an early stage, value add venture capital firm based in Israel. We invest in (or even start) young companies that create powerful consumer experiences, unique technologies or effective business models, to create high growth business op...",2
https://www.linkedin.com/company/twentyfiveventures,Twenty Five Ventures connects emerging businesses with resources and guidance so they can thrive and scale.,2
https://www.linkedin.com/company/3lcapital,"3L Capital is a global growth equity firm that invests in tech-enabled consumer and enterprise businesses in the early stages of growth. They provide expansion capital in the technology, consumer, and data services sectors. With offices in LA and NYC, ...",2
https://www.linkedin.com/company/mrtnzvc,"MRTNZ Ventures is a venture capital and private equity firm that invests in exceptional companies in the technology, fashion, golf, health, and travel industries. With a focus on avant-garde principles and the latest technology trends, MRTNZ Ventures s...",2
https://www.linkedin.com/company/everhope-capital,"EverHope Capital invests in entrepreneurs and businesses displacing animals from the supply chain. By supporting innovative and scalable alternatives to animal based products, EverHope Capital is investing for a more sustainable and humane future for t...",2
https://www.linkedin.com/company/capstarventures,Capstar Ventures is an early stage venture capital firm that invests in the next generation of innovative consumer companies. We seek to invest in the best and brightest entrepreneurs solving their own pain points and addressing unmet consumer needs in...,2
https://www.linkedin.com/company/syncom-venture-management-co.-llc,Syncom Venture Partners is a leading venture capital firm primarily focused on growth stage investments in emerging and underserved segments of the media and communications industry. Telecommunications,2
https://www.linkedin.com/company/divcowest,"DivcoWest is a vertically integrated real estate owner, operator, and developer with a national presence in the markets where talent and innovation thrive. They focus on delivering strategic real estate solutions to meet the evolving needs of their par...",2
https://www.linkedin.com/company/fivefourventures,"Five Four Ventures is a leading incubation and venture capital firm that provides capital, talent, and business building expertise to turn ideas into the leading companies of tomorrow. They target investments in early stage, disruptive technology produ...",2
https://www.linkedin.com/company/evc_ventures,"EVC Ventures is a Chicago-based venture capital fund and accelerator that helps entrepreneurs turn ideas into unicorns. They have a $50 million fund globally and are interested in EdTech, IoT, Mobile Apps, Enterprise Software, AI, Higher Education, and...",2
https://www.linkedin.com/company/reason-ventures-llc,"Reason Ventures is a company that provides Passion Driven Executive and Leadership Coaching and Mentoring. They aim to ignite the leader inside individuals and organizations, helping them reconnect their drive with their passion. They offer services su...",2
https://www.linkedin.com/company/countdown-capital,"Countdown Capital is a venture capital and private equity firm that invests in founders rebuilding the American industrial base at the earliest stages. Our goal is to help companies secure a free, prosperous future and unlock real, tangible progress fo...",2
https://www.linkedin.com/company/xfactor-ventures,"xfactor ventures is a seed stage venture capital fund run by female founders, backing female founders. They provide pre-seed and seed stage capital for companies founded by women. They support ambitious founders with the 'X Factor' - the insight and dr...",2
https://www.linkedin.com/company/greenbayventures,Green Bay Ventures is a San Francisco based venture capital firm backed by some of the world's most prominent families. Investing in innovation. Green Bay Ventures ('GBV') is a San Francisco based venture capital firm. We focus on a small number of hi...,2
https://www.linkedin.com/company/maine-venture-fund,"Maine Venture Fund is a professionally managed venture capital fund that invests exclusively in Maine companies which demonstrate a potential for high growth and public benefit. The Fund has been actively investing in Maine companies since 1997, after ...",2
https://www.linkedin.com/company/locusvc,"Locus Ventures is a seed fund founded in 2016 by Google, Facebook and Y Combinator alums. We invest in passionate founders looking to build important, world changing companies. Our partnership is unique in its wealth of startup founding and operating e...",2
https://www.linkedin.com/company/ascend-vc,"Ascend Venture Capital is a St. Louis based micro VC firm that provides financial and operational support to startup founders looking to scale. VC headquartered in St. Louis, MO. Ascend partners with founders to provide financial and operational suppor...",2
https://www.linkedin.com/company/evolution-vc,"Evolution VC is a venture capital investor partnering with exceptional entrepreneurs developing leading technology companies. We invest in early and growth stage technology startups across sectors and provide them with capital, customers, and talent. W...",2
https://www.linkedin.com/company/kairos-venture-investments-llc.,"Kairos Ventures is a venture capital and private equity firm that invests in groundbreaking startups and research in life sciences, physical sciences, and technology. They focus on ideas, patents, and businesses from the world's top universities and sc...",2
https://www.linkedin.com/company/abstraction-capital,Abstraction Capital is an early stage venture capital firm that provides funding for technical founders building products for developers and technical users. They focus on investing in devtools and infrastructure. Their belief is that all companies are...,2
https://www.linkedin.com/company/frontline-ventures,"Frontline is the venture firm for globally ambitious B2B companies on both sides of the Atlantic. Frontline Seed speeds up ideas at inception across Europe. Frontline X is a growth-stage fund, for fast and frictionless US-Europe expansion.",2
https://www.linkedin.com/company/work-life-ventures,"Worklife is a creator-friendly venture capital firm that invests in tools and services for the modern workplace. Founded by Brianne Kimmel, Worklife is the first VC firm designed for the new era of builders and creators.",2
https://www.linkedin.com/company/emerging-vc,Emerging Ventures Capital is a venture capital fund that invests in seed stage technology startups in the US and Canada. The company focuses on startups that are using emerging technologies to solve business challenges. They offer access to a diversifi...,2
https://www.linkedin.com/company/microventures,"MicroVentures is an online equity crowdfunding platform enabling angel investors to connect with startups to raise capital. Private market investment opportunities, highly vetted by our experienced team.",2
https://www.linkedin.com/company/keiki-capital-llc,"Keiki Capital is a venture capital firm that focuses on investing in climate fintech, decarbonization, and adaptation. The company believes in leveraging the power of capitalism to address global problems such as climate change, food and water scarcity...",2
https://www.linkedin.com/company/candor-venture-partners,"Candor Ventures is a start-up studio and venture builder that partners with proven founders to build, fund, and scale the next generation of technology companies. They provide instant, fee-free B2B payments for startups and small businesses, empower HV...",2
https://www.linkedin.com/company/rallycryvc,RallyCry Ventures is a venture capital firm that invests in ideas and helps entrepreneurs build their vision through their Rally to MVP process. They focus on being the first institutional investor before any capital has been raised. They prefer compan...,2
https://www.linkedin.com/company/bright-ventures-io,"Bright Ventures is a groundbreaking space for transformation in people, companies, and industries. We offer coaching, consulting, and community. Our mission is to create an inclusive economy. We work to build a future, together, that reflects the needs...",2
https://www.linkedin.com/company/imagination-capital,"Imagination Capital is an early stage VC investing in esports, big data/machine learning and digital media. We help turn imagination into innovation.",2
https://www.linkedin.com/company/conscience-vc,Conscience is an early stage firm investing in science empowering humanity. Venture Capital and Private Equity Principals,2
https://www.linkedin.com/company/newlin-vc,"Newlin VC is a venture capital firm that helps founders and investors sustain their financial success. They specialize in connecting founders to capital and turning ideas into fundable businesses. Newlin VC invests at the pre-seed, seed, and series A s...",2
https://www.linkedin.com/company/barrel-ventures,Barrel Ventures is a company that aims to address the challenges in the global supply chain and the broken global food ecosystem. They support innovative entrepreneurs who are creating businesses to fix these issues. Barrel Ventures provides venture ca...,2
https://www.linkedin.com/company/narrow-gauge-ventures,Narrow Gauge Ventures is an Ann Arbor based venture capital firm investing in companies building disruptive healthcare technologies. NGV is an early stage venture fund focused on investing in the best teams making healthcare more efficient.,2
https://www.linkedin.com/company/undeterred-capital,"Undeterred Capital is a deep tech and bioscience venture firm that invests in entrepreneurs solving seemingly impossible problems at the pre-seed and seed stages. They invest early in companies and focus on innovating in biological platforms, applied r...",2
https://www.linkedin.com/company/nct-ventures,"NCT Ventures is a Midwest-focused investment operating firm that supports seed and early-stage technology companies disrupting major industries. They invest in people first and ideas second, and are passionate about sharing their experiences and method...",2
https://www.linkedin.com/company/innovatingcapital,"Innovating Capital is a premier asset fund investing in the next frontier of early, growth, and lower middle market stage companies. It specializes in buy and build and incubation strategies across disruptive sectors and cutting edge technologies with ...",2
https://www.linkedin.com/company/manresaventures,"We invest in early stage teams designing simple products to solve important problems in FinTech, payments, small biz formation, e comm enablement and data, privacy, identity and fraud mitigation. Venture Capital and Private Equity Principals",2
https://www.linkedin.com/company/amplifyher-ventures,AmplifyHer Ventures is a venture capital firm that invests in diverse leadership teams with a unique ability to create flywheel effects of growth in new markets. They are opportunistic investors and believe that women are untapped rather than underfund...,2
https://www.linkedin.com/company/vectors-capital,"Vectors Capital is a mission-driven capital group that focuses exclusively on impact investment. They empower spectacular startups to address global challenges while achieving great financial returns. Their focus areas include sustainability, health an...",2
https://www.linkedin.com/company/keshif-ventures-llc,"Keshif Ventures, LLC is a private Angel Investing company that invests in early stage companies primarily in the High Tech sector, and generally in the San Diego, CA area. Keshif Ventures, LLC strives to invest in companies with strong teams and innova...",2
https://www.linkedin.com/company/q-ventures,"QVentures is a Venture Capital firm providing direct investment opportunities and fund management. QVentures sources, screens, and invests in top tier start ups from Seed to Series C. Our investors consist of Family Offices, Institutional Investors, UH...",2
https://www.linkedin.com/company/mgv-capital-group,"MGV Capital Group is a leading investment firm that specializes in venture capital and private equity investments. We provide funding and support to early-stage and growth-stage companies in various industries, including technology, healthcare, and con...",2
https://www.linkedin.com/company/overlooked-ventures,Overlooked Ventures is a venture capital fund investing in early stage companies with one or more historically ignored founders. We are the friends and family round you never had. A venture capital fund investing in early stage companies with one or mo...,2
https://www.linkedin.com/company/blindspot-ventures,Blindspot Ventures is a seed-focused venture capital fund based in Boston. We partner with remarkable founders building next-generation infrastructure and platform technologies to reshape industries. Our goal is to back iconoclastic founders who are ch...,2
https://www.linkedin.com/company/bonsal-capital,"Bonsal Capital is a private investment company investing in technology and technology enabled services in education, healthcare and cyber security solutions.",2
https://www.linkedin.com/company/stratminds-vc,"STRATMINDS is a San Francisco based VC and Advisory firm, established to help early stage tech startups with early stage venture capital investment and strategic advisory support. We work with ambitious founders to turn their innovative ideas into real...",2
https://www.linkedin.com/company/diversecity-ventures,"DiverseCity Ventures is an impact investing firm that backs companies with positive social, economic, or environmental impact and high potential for outsized returns. They focus on capitalizing on diverse perspectives to accelerate positive social, env...",2
https://www.linkedin.com/company/packventures,"Pack VC is a pre seed and seed venture fund supporting and investing in founders associated with the University of Washington (UW) network. We make the venture asset class available to the more than 400,000 global UW alumni.",2
https://www.linkedin.com/company/hackvc,Hack VC is a Crypto and Traditional Venture firm. We invest in Hackers that are changing the world.,2
https://www.linkedin.com/company/stadia-ventures,"Stadia Ventures is the Sports Innovation Hub for Entrepreneurs, Industry Executives and Investors. We are a community of exceptional entrepreneurs, industry experts, partners and investors driven to create sustained transformation in the world of sport...",2
https://www.linkedin.com/company/bluebearventures,Blue Bear Ventures is a venture capital and private equity firm that invests in technologies based on research innovations. They engage with founders working on the frontiers of science and technology to solve pressing challenges. Their focus areas inc...,2
https://www.linkedin.com/company/oceansventures,"Oceans is a seed stage VC firm that bets on teams, not just founders. We help great teams go faster. We lead pre seed and seed deals. Oceans believes that the most critical support that investors and advisors can provide a founder is helping create a g...",2
https://www.linkedin.com/company/datapower-ventures,DataPower Ventures invests in the exponential power of data to transform business. Venture Capital and Private Equity Principals venture capital angel investing data science developer tools machine learning data automation data intensive applications h...,2
https://www.linkedin.com/company/sidespin-ventures,"Sidespin Ventures is a pre seed and seed stage firm providing capital, mentorship, and hands on assistance to entrepreneurs building transformative technology companies.",2
https://www.linkedin.com/company/walden-venture-capital,"Walden Venture Capital targets Sprout Stage™ investments. We seek products or services with mass-market potential and powerful underlying technologies taking active supporting roles typically as first institutional investors. Our target sectors are digital media and cloud services for consumers and enterprise. We care deeply about Founders and Management and work diligently to help manifest their vision. Our portfolio includes leaders in music, mobile, internet media and breakthrough cloud services.",2
https://www.linkedin.com/company/subtractioncapital,Subtraction Capital is a venture capital fund that invests in early stage enterprise software companies in the San Francisco Bay Area and Salt Lake City. We focus on companies that best leverage our operating experience and deep professional networks. ...,2
https://www.linkedin.com/company/connetic-ventures,"Connetic Ventures is an early-stage VC Fund. We use AI to automate the decision making, make smarter decisions, and remove bias.",2
https://www.linkedin.com/company/interlace-ventures,"Interlace Ventures is an early stage venture capital firm investing in founders reimagining commerce. We invest in founders reimagining commerce. We are hands on, ex operators in global retail, supporting our community of founders. We have an active co...",2
https://www.linkedin.com/company/bluepointeventures,"BluePointe Ventures is a venture capital and private equity firm that invests in founders who are leveraging frontier technology to create innovative products and services. Our investments span a wide range of industries, from AI-based bots to marketpl...",2
https://www.linkedin.com/company/monozukuriventures,"Monozukuri Ventures is a hardware-focused venture capital firm that provides investment and support to startups in Japan and North America. They specialize in helping startups with manufacturing needs, offering services such as prototyping and mass pro...",2
https://www.linkedin.com/company/atlasview-equity,Atlasview Equity Partners is a private equity firm specializing in software and tech enabled businesses. We combine patient capital with proven operational strategies to deliver predictable results for our stakeholders. Find out why Atlasview is the id...,2
https://www.linkedin.com/company/jirau-capital-management,Jirau Capital Management is an evidence-based investment management firm with a special interest in the pharmaceutical and biotechnology industries. They offer customized investment advisory services with exposure to the latest advances in biotechnolog...,2
https://www.linkedin.com/company/lancaster-investments,"Lancaster Investments is a trusted firm in the Wisconsin investment ecosystem. They have a track record of finding the next big thing in various industries and sectors. They invest in companies at every stage, from seed to growth, and provide them with...",2
https://www.linkedin.com/company/epakoncapital,"Epakon Capital is an early stage, high growth VC fund investing in category defining businesses. For founders, by founders. Investing in categories defining businesses across Fintech/Web3, Marketplaces/Logistics, and Software. 25+ Investments to date. ...",2
https://www.linkedin.com/company/ascend-venture-capital,"Ascend.vc is a preseed venture capital fund that empowers kids with engaging books, podcasts, and classes. They also support adyn in creating a new standard of care for birth control and closing gaps in medical research. Additionally, they provide Attu...",2
https://www.linkedin.com/company/firstdropventures,"First Drop Ventures is a pre-seed venture studio based in Santa Monica, CA. We provide strategic guidance, operational support, technology infrastructure and development, as well as pre-seed capital to startups. Our goal is to help portfolio companies ...",2
https://www.linkedin.com/company/freshtracks-capital,FreshTracks Capital is a Vermont-based venture capital fund that invests in seed and early-stage entrepreneurial companies in Northern New England. They focus on technology and consumer investments and provide strategic resources and capital to support...,2
https://www.linkedin.com/company/pathventures,Path Ventures is a pre seed Venture Capital firm investing in technology companies at the earliest stages of their journeys. Investment Management,2
https://www.linkedin.com/company/golden-gate-ventures,"Golden Gate Ventures is a venture capital firm investing across Southeast Asia. Since 2011, the firm has launched four funds, managed US$250M AUM, and invested in 60+ companies in over 7 countries in Asia. The firm focuses on investing in technology co...",2
https://www.linkedin.com/company/red-beard-ventures,"Red Beard Ventures is a Venture Capital Firm that invests in disruptive companies from seed to growth. Our team has been working in and around the startup ecosystem for 15+ years. Building, investing and advising startups has helped us to gain a keen s...",2
https://www.linkedin.com/company/scrum-ventures,"Scrum Ventures is an early stage venture firm that has invested in over 80 startups across a range of industries in the U.S. and Japan. Based in San Francisco with extensive experience and networks in both Silicon Valley and Japan, Scrum Ventures accel...",2
https://www.linkedin.com/company/iterative-capital,"Iterative is an accelerator focused exclusively on Southeast Asia. Founded by cofounders of Decide.com (acquired by eBay), Iterative differentiates itself with partners, mentors, advisors, and investors who have all previously started, sold, and operat...",2
