https://www.linkedin.com/company/gsquaredequitymanagement,g2—was founded in 2011 with the fundamental belief that venture backed companies were staying private longer.,2
https://www.linkedin.com/company/pivacapital,Piva Capital is a venture capital firm based in San Francisco that invests in disruptive energy and industrial companies across North America and Europe. They have a team of accomplished domain experts who work with creative entrepreneurs to address th...,2
https://www.linkedin.com/company/pjcvc,"PJC Ventures is an experienced Boston venture firm with a start-up mindset. They understand the challenges that founders face because they have been there too. With decades of experience in thriving and surviving in recessions and booms, PJC Ventures k...",2
https://www.linkedin.com/company/omx-ventures,"OMX Ventures is a VC firm investing in early stage companies building tools and instrumentation for life sciences, and novel platforms for therapeutics and diagnostics. Investing at the convergence of biology and computing to support a new generation o...",2
https://www.linkedin.com/company/m12vc,"M12 Venture Capital is Microsoft's venture capital fund that invests in early stage technology companies disrupting the enterprise. They empower entrepreneurs with capital, customer connections, and unparalleled access to Microsoft. M12's mission is to...",2
https://www.linkedin.com/company/pelion-venture-partners,"Pelion Venture Partners is an early stage venture capital firm that partners with innovative entrepreneurs to launch dynamic and groundbreaking companies. With expertise and a track record dating back to 1986, Pelion provides hands-on support and strat...",2
https://www.linkedin.com/company/psgequity,PSG is a leading growth equity firm that partners with software companies to capitalize on transformational growth and strategic opportunities.,2
https://www.linkedin.com/company/wisemont-capital,"Wisemont Capital is a fund that makes equity investments in technology companies in the seed stage to series A. They have a primary focus on IoT & Robotics, Software B2B, Healthcare, Artificial Intelligence, and Cloud & Big Data. The company believes t...",2
https://www.linkedin.com/company/arctern-ventures,"ArcTern Ventures is a cleantech venture capital fund based in Toronto, Canada and investing in early stage disruptive ideas.",2
https://www.linkedin.com/company/nttventurecapital,NTTVC is an independent venture capital firm that invests across sectors and partners with founders from their first inspiration through the full expression of their vision.,2
https://www.linkedin.com/company/eos-venture-partners,"Eos Venture Partners is a Strategic Venture Capital Fund, focused exclusively on insurance technology (#InsurTech).",2
https://www.linkedin.com/company/toyota-ai-ventures,"Toyota Ventures is Toyota’s first standalone early stage venture capital firm, investing in early stage startups in AI, cloud, autonomy, mobility, robotics, smart cities, digital health, fintech, energy, materials, and carbon neutrality.",2
https://www.linkedin.com/company/shima-capital,Shima Capital is an early stage global venture firm focused on supporting cutting edge blockchain startups. We invest in disruptive web3 and blockchain technology companies.,2
https://www.linkedin.com/company/bloctech-investment-group,"BlocTech Investment Group is a Texas based, research focused fund that invests in the future of blockchain, emerging technologies, and startups. VISION – We endeavor to create positive global impact, helping shape the future through meaningful investme...",2
https://www.linkedin.com/company/flagship-ventures,"Flagship Ventures is a venture capital firm that focuses on developing disruptive innovations in the fields of therapeutics, health technologies, and sustainability. The firm operates through two synergistic units: VentureLabs(TM) Flagship, which devel...",2
https://www.linkedin.com/company/clearvision-ventures,"Clearvision Ventures is a venture capital firm formed by entrepreneurs dedicated to helping other entrepreneurs build category leading companies. Our primary goal is to help entrepreneurs achieve success by providing them with the necessary funding, ex...",2
https://www.linkedin.com/company/initialized-capital,"Initialized Capital is a San Francisco based early stage venture capital firm with over $700M in assets under management. We focus on investing in high potential software startups at seed stage and earlier, and are happy to be the first investors in ea...",2
https://www.linkedin.com/company/ms-ad-ventures,"MS&AD VENTURES is a corporate venture capital firm that focuses on early-stage technology companies in the fields of Fintech, InsurTech, AI, IoT, Big Data, and Cybersecurity. As an affiliated company of MS&AD Insurance Group Holdings, the 7th largest i...",2
https://www.linkedin.com/company/verance-capital,"Verance Capital is a venture capital and private equity firm that specializes in investing in the sports, media, and live entertainment industries. They partner with leading entrepreneurs and management teams to provide early and growth stage capital. ...",2
https://www.linkedin.com/company/bootstrapventurepartners,"Bootstrap Venture Partners is a team of experienced entrepreneurs dedicated to helping aspiring entrepreneurs. They seek out companies whose products and services they believe will have a meaningful effect on the greater good, and help them succeed. Th...",2
https://www.linkedin.com/company/third-rock-ventures,Third Rock Ventures is a leading healthcare venture firm focused on advancing disruptive areas of science and medicine to deliver breakthroughs. They invest in transformational life science companies that show high growth potential and are well positio...,2
https://www.linkedin.com/company/violaventures,"Viola Group, established in 2000, is an Israeli private equity investment group with over $3 billion under management.",2
https://www.linkedin.com/company/hof-capital,HOF Capital is a global technology investment firm that leverages its global limited partner network to help founders build massive businesses.,2
https://www.linkedin.com/company/newschools-venture-fund,"NewSchools Venture Fund is a national nonprofit venture philanthropy working to reimagine public education. Since our founding in 1998, we have invested nearly $200 million in 200 education ventures. Our investments were instrumental in the creation of...",2
https://www.linkedin.com/company/nfxvc,NFX is a venture capital firm specializing in pre-seed and seed stage investments. They support exceptional founders in building market-transforming companies and operate as an invite-only guild for digital networks and marketplaces. NFX emphasizes the...,2
https://www.linkedin.com/company/mpm-capital,MPM Capital is a world leading biotechnology investment firm with nearly three decades of experience creating and investing in companies that seek to translate scientific innovations into cures for major diseases. With its world class team and deep exp...,2
https://www.linkedin.com/company/humlaventures,A VC fund dedicated to world class entrepreneurs and financial ecosystem transformation. Currently raising second fund initiative of @xbtogroup.,2
https://www.linkedin.com/company/fusionx-ventures,"FusionX Ventures is a Southern California based venture capital firm that invests in promising, early stage startups in technology, industrial and medical/life science sectors. Our portfolio companies create market leading solutions at the intersection...",2
https://www.linkedin.com/company/ibex-investors-llc,Ibex Investors is a multi-strategy investment firm that provides a world-class experience and aims to drive value to portfolio companies beyond just cash. They proactively seek out markets and opportunities commonly dismissed or overlooked. Ibex invest...,2
https://www.linkedin.com/company/huntington-avenue-ventures,Huntington Avenue Ventures is an early stage fund that invests in companies affiliated with Northeastern University. They aim to empower innovative and disruptive Northeastern affiliated companies by providing capital and access to their value network ...,2
https://www.linkedin.com/company/polychain-capital,Polychain Capital is an investment firm that focuses on actively managed portfolios of blockchain assets. They invest in protocols and companies in the blockchain space to advance the global adoption of cryptocurrencies.,2
https://www.linkedin.com/company/origin-ventures,"Origin Ventures is a nationwide early stage venture capital firm investing in the Digital Native Economy. Origin Ventures is an early stage venture capital firm in Chicago, IL. Origin is currently investing out of their third fund, focusing on Origin V...",2
https://www.linkedin.com/company/red-cedar-ventures,Red Cedar Ventures provides much-needed pre-seed funding and investment capital to early-stage startups coming out of the Michigan State University ecosystem.,2
https://www.linkedin.com/company/matrix-capital-advisors-llc,"CI Matrix Private Wealth is a registered investment advisor that serves high net worth individuals, families, and private foundations. They offer unbiased expert wealth management services to preserve and enhance a client's wealth. CI Matrix operates a...",2
https://www.linkedin.com/company/monroe-capital,"Monroe Capital LLC is a premier boutique asset management firm specializing in private credit markets across various strategies including, direct lending, asset based lending, specialty finance, opportunistic and structured credit, and equity. Since 20...",2
https://www.linkedin.com/company/commerce-ventures,Commerce Ventures is an early stage venture capital firm focused on investing and empowering the next generation of technology innovators in the retail and financial services industries. They partner with entrepreneurs who are building the platforms re...,2
https://www.linkedin.com/company/valuestream-ventures,"At ValueStream Ventures, we are a thesis driven, early stage fund based in NYC and focused on investing in B2B platforms built around high value data. We gravitate towards investments in B2B software, data/analytics, and fintech. Our thesis is a combin...",2
https://www.linkedin.com/company/inventures-collective,"Inventures.vc is a venture capital firm that invests in early-stage technology companies. They provide funding, mentorship, and strategic support to help startups grow and succeed. With a focus on disruptive technologies, Inventures.vc aims to identify...",2
https://www.linkedin.com/company/highland-capital-partners,"Highland Capital Partners is a global venture capital firm focused on putting the entrepreneur first. With offices in Silicon Valley, Boston and Shanghai, Highland has raised over $3 billion in committed capital and invested in more than 225 companies,...",2
https://www.linkedin.com/company/poplar-ventures,Poplar Ventures is a venture capital firm investing in early growth stage companies delivering recurring revenue cloud based software services. Poplar supports its portfolio companies by leveraging the proven operating experience of its team and advisors.,2
https://www.linkedin.com/company/humandotcapital,"Human Capital is a venture firm that invests in ambitious builders, founders, teams, and startups. With over $1.3B in total capital committed, we have supported 15 companies before they became unicorns, including Snowflake, Anduril, Livongo, and Brex. ...",2
https://www.linkedin.com/company/illumina-ventures,"Illumina Ventures is an independent firm that focuses on investing in early stage companies in the genomics and precision medicine space. They invest in companies that are pioneering new applications of genomics and enabling precision medicine, includi...",2
https://www.linkedin.com/company/waverley-capital,"Waverley Capital is a venture capital and private equity firm that specializes in providing capital and strategic support to early-stage and growth-stage companies. With a focus on technology and innovation, Waverley Capital invests in companies across...",2
https://www.linkedin.com/company/cmfg-ventures,"CMFG Ventures, venture capital arm of @CUNAMutualGroup. We look for companies motivated to bring new technology and innovation to credit unions and members.",2
https://www.linkedin.com/company/fin-venture-capital,Fin is an asset management firm investing full lifecycle in FinTech and adjacent verticals in principally B2B enterprise SaaS companies.,2
https://www.linkedin.com/company/foundation-capital-investments-and-advisory,Foundation Capital Investments and Advisory is a company that provides investment and advisory services.,2
https://www.linkedin.com/company/gva-capital,"GVA Capital is a VC firm with the focus on Fintech, Artificial Intelligence, Neural Networks, Cloud Storage, Space and Big Data projects. Located in the heart of San Francisco, GVA Capital provides companies with all the necessary resources and connect...",2
https://www.linkedin.com/company/corner-ventures,Corner Ventures is a venture capital firm that invests in the next generation of iconic technology companies. They partner with top tier early stage venture firms and exceptional entrepreneurs to create exceptional outcomes. They provide unique insight...,2
https://www.linkedin.com/company/rethink-capital-partners,Connecting capital to impact. Rethink Capital Partners is a purpose-driven investment manager. We specialize in real estate and venture capital with impact at the core of all we do. We believe that by focusing on real solutions to our most pressing cha...,2
https://www.linkedin.com/company/elevate-ventures-inc-,"Elevate Ventures is a venture capital firm that invests in high potential cross-sector innovative companies at the pre-seed, seed, and early stages. They focus on nurturing and developing emerging and existing high potential businesses into high-perfor...",2
https://www.linkedin.com/company/correlation-ventures,"Correlation Ventures is a new breed of venture capital firm, leveraging world class analytics to offer entrepreneurs and other venture capitalists a dramatically better option when they are seeking additional capital to complete a financing round. Back...",2
https://www.linkedin.com/company/clocktower-technology-ventures,Clocktower Technology Ventures is a Santa Monica based venture capital business focused exclusively on financial technology. Clocktower Ventures invests in people who are reinventing financial services and solving climate change. They support leading c...,2
https://www.linkedin.com/company/benchmark-vc,"Benchmark is an early stage venture capital firm focused on social, mobile, local and cloud companies. We believe that great entrepreneurs change the world for the better. Since its founding in 1995, Benchmark has invested in more than 250 early stage ...",2
https://www.linkedin.com/company/black-diamond-ventures,"Black Diamond Ventures is a transformational venture capital firm that specializes in nurturing growth one deal at a time. Led by Christopher B. Lucas, the firm tailors each investment to its unique form and takes a hands-on approach. With their agilit...",2
https://www.linkedin.com/company/hanhai-investment,"Hanhai Investment is a startup incubator that provides co-working space, mentorship programs, seed funding, legal, accounting, and marketing services for startups. They focus on supporting mission-driven entrepreneurs who are innovative, ambitious, and...",2
https://www.linkedin.com/company/american-family-ventures,"American Family Ventures is an Insurtech venture capital pioneer, focusing on early stage startups that are shaping the future of the insurance industry.",2
https://www.linkedin.com/company/aspect-ventures,"Aspect Ventures is a venture capital firm that works with leading entrepreneurs across the arc of their companies' growth. They focus on technologies for a multi-platform, multi-device world. They invest in companies that are leveraging data and interc...",2
https://www.linkedin.com/company/autotech-ventures,"Autotech Ventures is an early stage venture capital firm with a mission to solve the world’s ground transport challenges with technology, realizing the next frontier in mobility. They provide startups with capital, ground transportation market intellig...",2
https://www.linkedin.com/company/forgepoint-capital,Forgepoint Capital is a multi-stage venture capital firm that invests in transformative companies protecting the digital future. They partner with exceptional entrepreneurs tackling the biggest challenges in cybersecurity and infrastructure software. T...,2
https://www.linkedin.com/company/alumniventures,"Alumni Ventures is America's largest venture firm for individual investors, offering professional-grade venture capital portfolios since 2014. With a network of 10,000+ investors, we provide access to diversified venture portfolios in highly competitiv...",2
https://www.linkedin.com/company/congruent-ventures,"Congruent Ventures is an early stage venture firm that invests in transformative companies in sustainability/alternative energy/food/supply chain/mobility. Congruent Ventures is a venture capital firm that seeks to invest in Mobility and Urbanization, ...",2
https://www.linkedin.com/company/broadview-ventures-inc,"Broadview Ventures is a mission-driven investment organization focused on accelerating the development of promising technology for the diagnosis and treatment of cardiovascular disease and stroke. They invest in companies like Cardiosense, which is bui...",2
https://www.linkedin.com/company/battery-ventures,"Battery Ventures is a global investment firm that specializes in technology companies. With offices in Boston, San Francisco, Menlo Park, New York, London, and Tel Aviv, Battery has been investing in technology companies since 1983. The firm has invest...",2
https://www.linkedin.com/company/anterra-capital,Anterra Capital invest in entrepreneurs who are making a positive impact in global health and nutrition.,2
https://www.linkedin.com/company/flare-capital-partners,"At Flare Capital, we do more than simply provide capital for early stage and emerging growth healthcare technology companies.",2
https://www.linkedin.com/company/perfect-balance-investments,"Perfect Balance Investments is a group of experienced investors, businessmen, lawyers, and financial advisers that look to invest in and actively help small businesses scale and exit.",2
https://www.linkedin.com/company/panoramicvc,Panoramic Ventures is a venture capital firm based in Atlanta that takes a “wider view” approach to investing by targeting the south east and Midwest and placing a focus on diverse founders and university startups.,2
https://www.linkedin.com/company/castle-island-ventures,Castle Island Ventures is an early stage venture capital firm exclusively focused on public blockchains. We invest in infrastructure and application companies that will enable these transformative protocols to power services for the next billion users....,2
https://www.linkedin.com/company/alpha-venture-partners,Alpha Partners is a next generation growth equity firm that focuses on accelerating private technology companies. They partner with over 675 early stage venture capital firms to invest in the best growth stage venture backed companies. Alpha Partners f...,2
https://www.linkedin.com/company/boldcapitalpartners,BOLD Capital Partners is a venture capital firm that invests in people and technologies that have the potential to transform the world. They seek out entrepreneurs and companies who share a fierce vision for a brighter tomorrow. BOLD identifies emergin...,2
https://www.linkedin.com/company/beresford-ventures-llc,"Beresford Ventures is a venture capital firm founded in 2018 by three Floridians. Since then, the company has grown to include four partners and has invested $9 million in over 140 companies across various sectors and geographies. They primarily focus ...",2
https://www.linkedin.com/company/august-capital,August Capital is a venture capital firm founded in 1995. They invest in companies differentiated by technical innovation and entrepreneurial excellence. Their six partners have more than a century of combined venture and operational experience. August...,2
https://www.linkedin.com/company/bain-capital,Bain Capital is one of the world's leading multi-asset alternative investment firms. Our global team aligns our interests with those of our investors and partners for lasting impact.,2
https://www.linkedin.com/company/bmw-i-ventures,"BMW i Ventures is a Silicon Valley based venture capital firm that invests in purpose driven entrepreneurs building high performance companies. They provide access to resources and an ecosystem of specialists across hardware, software, and sustainabili...",2
https://www.linkedin.com/company/lumos-capital-group,"Lumos Capital Group is an investment firm focused on the human capital development sector globally. They invest in dynamic growth stage companies in the education technology, workforce development, and knowledge services sectors. Their mission is to be...",2
https://www.linkedin.com/company/ten-eleven-ventures,"Ten Eleven Ventures is a specialized venture capital firm that focuses on investing in innovative cybersecurity companies. They provide capital, connections, and expertise to support cybersecurity entrepreneurs in bringing game-changing technologies to...",2
https://www.linkedin.com/company/newark-venture-partners,"Located in the heart of Newark, New Jersey minutes away from New York City. Newark Venture Partners is blazing the trail for the Tech ecosystem with a world-class venture fund and Accelerator program focused on founders.",2
https://www.linkedin.com/company/transform-vc,"Transform VC is a venture studio, VC investment firm, and advisory company. Founded by Raed A. Masri, Transform focuses on identifying and building conviction in opportunities in the earliest stages, particularly in markets that are perceived as diffic...",2
https://www.linkedin.com/company/mechanism-capital,"Mechanism Capital is a venture capital and private equity firm that focuses on investing in early-stage technology companies. With a team of experienced principals, Mechanism Capital provides funding, strategic guidance, and operational support to help...",2
https://www.linkedin.com/company/pomegranate-vc,"Pomegranate Ventures provides diversified access to pre-IPO investments. They specialize in direct secondary investments in private pre-IPO companies. Their services include venture capital and private equity principals, venture capital secondaries, an...",2
https://www.linkedin.com/company/saints-capital,Saints Capital is a leading direct secondary firm that provides flexible capital solutions. They specialize in buying secondary shares and helping end-of-life VC funds. Saints Capital is dedicated to providing liquidity to investors in private companie...,2
https://www.linkedin.com/company/impression-ventures,"Impression Ventures is a leading #FinTech focused venture fund, investing in seed stage companies across North America since 2013",2
https://www.linkedin.com/company/canary-venture-capital,"Canary is a venture capital and private equity firm that is the first institutional investor in leading technology companies in Latin America. They provide funding, insights, connections, and talent to back the companies that are shaping the future of ...",2
https://www.linkedin.com/company/creative-ventures-vc,"Creative Ventures is a deep tech venture firm investing in early stage companies solving humanity's most critical crises. Led by a team of world class experts, our deep tech acumen is informed by rigorous research, unmatched market understanding, and t...",2
https://www.linkedin.com/company/nightventures,Night Ventures is an early stage consumer fund that invests in the best teams building new consumer tech and helps them navigate new forms of customer acquisition. Their LPs are some of the most famous people on the internet who drive popular culture t...,2
https://www.linkedin.com/company/liveoak-venture-partners,LiveOak is a Texas venture capital firm that partners with visionary entrepreneurs who use disruptive technologies and business models to challenge the status quo.,2
https://www.linkedin.com/company/hgventures,"The corporate venture arm of The Heritage Group, specializing in investing and partnering with companies developing advanced materials & sustainable technology.",2
https://www.linkedin.com/company/pace-capital,PACE CAPITAL is an early stage venture capital firm in New York City. Pace Capital is an early stage venture capital firm focused on series A investments. Venture Capital and Private Equity Principals,2
https://www.linkedin.com/company/buildingventures,"Building Ventures is a venture capital firm based in Boston, MA. We partner with Built Environment entrepreneurs and early stage startups. Early stage venture firm committed to innovation in the built world. #ForABetterBuiltWorld Building Ventures inve...",2
https://www.linkedin.com/company/fall-line-capital,"We manage and purchase farmland throughout the United States, and invest in technology companies that are strategic to our land holdings.",2
https://www.linkedin.com/company/stormbreaker-ventures,"Stormbreaker Ventures is an early stage investment firm focused on capital efficient startups. We partner with high velocity, high conviction companies that prioritize disciplined decision making and market traction over chasing stepped up valuations. ...",2
https://www.linkedin.com/company/pillar-vc,"Pillar VC is a Boston-based VC firm supporting unstoppable founders with early stage and seed funding, focusing on personal and professional growth to build transformative technology companies.",2
